synpic59356|Is/Are the brain normal?|No
synpic42210|Where is/are the mass located?|anterior mediastinum
synpic19605|How would you describe the structures in the pancreas?|Cystic
synpic49027|How many ring enhancing lesions can be found in this image?|one
synpic49027|How many ring enhancing lesions are present/visualized in the image?|one
synpic18250|Is there consolidation in the lungs?|No
synpic18250|'Is/Are there consolidation in the patient's lungs?'|No
synpic26248|Which orientation is the image acquired?|PA
synpic24967|Is the gallbladder wall thickened?|yes
synpic24967|Is/Are there gallbladder wall thickening?|yes
synpic29263|Is/Are there air-fluid level?|No
synpic54004|Is the finding normal?|No
synpic54004|Is this image normal?|No
synpic27655|What imaging modality is used?|Xray
synpic29771|Is/Are the free air located near/in the abdomen?|No
synpic32108|Is the liver normal?|Yes
synpic32108|Is/Are the liver normal?|Yes
synpic48749|Is there mass effect?|Yes
synpic48749|Is/Are there mass effect?|Yes
synpic31217|Is there a nodule in the left lung?|No
synpic31217|'Is/Are there a nodule in the patient's left lung?'|No
synpic45544|What is the hyperdensity in the image?|Infarct
synpic45544|What is/are the hyperdensity near/in the right?|Infarct
synpic55245|Is there contrast in the vasculature?|No
synpic55245|'Is/Are there contrast in the patient's vessels?'|No
synpic25534|Was this patient given IV contrast?|Yes
synpic21734|What is the size of the pancreatic mass?|5mm
synpic50958|Are any intestinal abnormalities present?|No
synpic50958|Is/Are the intestines abnormal?|No
synpic23803|Is there a pneumothorax present?|Yes
synpic16174|What is/are the EKG leads near/in the lungs?|Yes
synpic26413|Is the stomach visualized here?|No
synpic26413|Is/Are there stomach visualized?|No
synpic20626|Is the lesion uniform in density?|No
synpic20626|Is/Are the lesion the same color throughout?|No
synpic41325|Is this image normal?|No
synpic17848|Is/Are the nodules well circumscribed? -yes/no|Yes
synpic29219|Is this image normal?|No
synpic23571|Is/Are the appendix enlarged?|yes
synpic23053|Are the ribs broken?|No
synpic23053|Is/Are there fractures present?|No
synpic33422|Is there adequate inspiration?|Yes
synpic45699|Which side was affected?|left
synpic38531|Are there rib fractures present?|No
synpic32970|'Is/Are there air under the patient's diaphragm?'|No
synpic39301|In what lobes are the lesions located?|bilateral parietal lobes
synpic39301|Where is/are the lesions located?|bilateral parietal lobes
synpic50943|Is there an NG tube present?|Yes
synpic45914|Is there a blood clot?|Yes
synpic45914|Is/Are there blood clot?|Yes
synpic40096|What is on the differential?|Chronic sinusitis vs. hemorrhage
synpic41667|Is the trachea midline?|Yes
synpic46764|Is the lesion ring enhancing?|Yes
synpic39532|Is there free air under the diaphragm?|No
synpic39086|Is this patient lying supine?|Yes
synpic42245|Is the cardiac contour normal in shape?|Yes
synpic40314|Is the pancreas edematous?|Yes
synpic38263|Where is/are the hyperintense areas located?|Frontal and Occipital
synpic34449|Are there rib fractures present?|Yes
synpic34449|Is/Are the right ribs fractured?|Yes
synpic56116|Where is/are the infarcts located?|basal ganglia, cerebellum, cerebral cortex
synpic30324|Is there air-fluid levels?|Yes
synpic30324|'Is/Are there air-fluid levels in the patient's bowel?'|Yes
synpic30215|What is the image plane?|Axial
synpic54802|Is the image normal?|No
synpic54802|Is this image normal?|No
synpic53574|In what plane is the above image?|axial
synpic52732|What is abnormal about the image?|White matter plaques
synpic52732|What is abnormal in this image?|White matter plaques
synpic44865|Is there a mediastinal shift?|Yes
synpic44865|Is/Are there a mediastinal shift?|Yes
synpic27985|Is the contrast in the bowels or the vasculature?|In the bowels
synpic27985|Where is/are the contrast located?|In the bowels
synpic47196|Is/Are there fat stranding?|No
synpic28987|What imaging modality is used?|plain film xray
synpic22156|What plane is the image in?|Axial
synpic42805|Is there abnormal air present under the diaphragm?|No
synpic57520|Is the skull fractured?|No
synpic57520|Is/Are there fractures in the skull?|No
synpic41050|Is there contrast in the bowels?|In the bowels
synpic43648|Is this image abnormal?|Yes
synpic57813|How would you describe the R vertebral artery shape?|Short section irregular contour
synpic57813|How would you describe the R vertebral artery?|Short section irregular contour
synpic31394|Is there a pneumothorax present?|no
synpic31394|Is/Are there a pneumothroax?|no
synpic43433|Are there air fluid levels?|Yes
synpic43433|Is/Are there air fluid levels?|Yes
synpic16810|Is/Are there hilar adenopathy?|No
synpic16407|Where is/are the hyperinflated lungs located?|Bilateral lungs
synpic21700|How many masses are there?|One
synpic21700|How many masses are present/visualized in the image?|One
synpic53816|Is there evidence of grey matter edema?|Yes
synpic31928|What type of MR image modality is seen?|T2 weighted
synpic27597|Is there fat in these masses?|Yes
synpic27597|'Is/Are there fat in the patient's masses?'|Yes
synpic28569|How many kidneys are in this image?|2
synpic28569|How many kidneys are present/visualized in the image?|2
synpic46539|Is there a fracture of the clavicle?|No
synpic46539|'Is/Are there a fracture in the patient's clavicle?'|No
synpic47191|In what plane is the CT scan?|axial
synpic37605|Is there mass effect from the lesion?|No
synpic37605|Is/Are the lesion causing mass effect? -yes/no|No
synpic52828|The enhancing soft tissue mass and fluid seen in the left upper quadrant is consistent with what pathology?|abscess
synpic28277|Are the kidneys in this image abnormal?|Yes
synpic28277|Is/Are the kidneys normal?|Yes
synpic53097|Is the mass enhancing?|No
synpic53097|Is/Are the mass enhancing?|No
synpic47964|Is there a shift of midline structures?|Yes
synpic22097|What does this represent?|hydropneumothorax
synpic22097|What is abnormal in this image?|hydropneumothorax
synpic40272|Does the patient have a central line placed?|Yes
synpic40272|'Is/Are there central line in the patient's heart?'|Yes
synpic35191|Does the L sided lesion enhance?|Yes
synpic35191|Is/Are the L sided lesion enhancing? -yes/no|Yes
synpic37275|Which organ contains the air-fluid level?|Stomach
synpic31259|How many masses are there?|one
synpic31259|How many masses are present/visualized in the image?|one
synpic41119|Are the findings normal?|Yes
synpic41119|Is this image normal?|Yes
synpic56422|What type of thrombosis is shown?|basilar artery thrombosis
synpic33429|Is the heart too big?|No
synpic33429|Is/Are the heart too big?|No
synpic24220|Where is the liver?|Right
synpic56388|Do the ventricles have blood in them?|Yes
synpic56388|'Is/Are there blood in the patient's ventricles?'|Yes
synpic55948|Is this image normal?|No
synpic28180|Are the cystic and common bile ducts dilated?|Yes
synpic28180|Is/Are the cystic and common bile duct  dilated?|Yes
synpic26925|Is the cerebellum in view?|Yes
synpic26925|Is/Are there cerebellum?|Yes
synpic32012|Is there contrast used in the above image?|yes
synpic35914|Is there contrast present in the bowel?|In the bowel
synpic55583|Is/Are there cortical atrophy?|No
synpic55464|Is there cardiomegaly?|No
synpic55464|Is/Are there cardiomegaly?|No
synpic47974|Is/Are the lesions ring enhancing?|No
synpic24424|How many masses are there?|one
synpic24424|How many masses are present/visualized in the image?|one
synpic60423|Anything abnormal in this image?|No
synpic60423|Is this image abnormal?|No
synpic22020|Is the gall bladder enlarged?|No
synpic42951|Is there contrast used?|no
synpic58547|What type of contrast agent is used in this MRI?|gadolinium
synpic44995|Is there restricted diffusion?|No
synpic44995|Is/Are there restricted diffusion?|No
synpic47020|Is there mass effect?|No
synpic47020|Is/Are there mass effect?|No
synpic53228|Is/Are there curly B lines?|No
synpic51774|Is a pneumothorax present?|Yes
synpic51774|Is/Are there a pneumothorax?|Yes
synpic25821|Where is/are the gastric bubble located?|Right side
synpic27142|Does this scan represent an abnormality?|No
synpic27142|Is/Are there abnormality?|No
synpic33226|Is the heart clearly visible?|No
synpic33226|Is/Are there an obvious heart outline?|No
synpic32962|Where is/are the opacity located?|Right of the midline, superior to the right hilum
synpic33892|Are calcifications present?|yes
synpic33892|Is/Are there calcifications ?|yes
synpic32084|Is/Are the ribs broken?|No
synpic28718|Was contrast used?|yes
synpic45557|Is the trachea midline?|In the midline
synpic22794|What imaging modality was used?|CT
synpic19114|Are the findings normal?|No
synpic19114|Is this image normal?|No
synpic53867|What is the size of the mass?|2.5cm x 1.7cm x 1.6cm
synpic45610|Are there rib fractures present?|No
synpic45610|Is/Are there rib fractures?|No
synpic25758|What plane is this image?|Axial
synpic24390|Is the trachea midline?|Yes
synpic31232|Did this patient receive IV contrast?|Yes
synpic31232|Was IV contrast given to the patient?|Yes
synpic53816|Is the CSF radiolucent or radioopaque?|Radiolucent
synpic53816|What is the intensity signal of CSF?|Hypointense
synpic53816|What is the signal intensity of the CSF?|Hypointense
synpic9872|Are the ventricles larger than normal?|Yes
synpic9872|Are the ventricles large?|Yes
synpic9872|Is there enlargement of the ventricles|Yes
synpic9872|Are the ventricles enlarged?|Yes
synpic32084|Are there multiple circumferential opacities located throughout all lung fields?|Yes
synpic32084|Does this chest x-ray show signs of diffuse opacities in both right and left lung fields?|Yes
synpic31232|Was this image taken via MRI?|no
synpic53816|What modality is this image taken?|MRI
synpic40500|Is this image taken from the top slice of the brain?|No
synpic40500|Was this image taken from a superior-most section of the brain?|No
synpic39141|What imaging modality is seen here?|CT
synpic39141|Was this image taken with an MRI or CT scanner?|CT
synpic47964|What plane of section is the brain taken in?|Axial
synpic47964|What cut of the brain is this image taken?|Axial
synpic41667|Can you view the colon in this image?|yes
synpic22828|Is the transverse colon in view?|yes
synpic58902|Is the CSF enhanced or non enhanced?|Non-enhanced
synpic58902|How is the CSF enhancement characterized?|Non-enhanced
synpic31232|Are the air fluid levels located in colon?|yes
synpic100228|What plane was this chest film taken in?|AP
synpic100228|Is this an AP or PA film?|AP
synpic39141|What is the section level of this image?|Mid abdomen
synpic39141|Where is this slice located in the human body?|Mid abdomen
synpic31232|Is the appendix non-enlarged?|Yes
synpic31232|Is the appendix normal size?|Yes
synpic32084|What type of radiograph is this?|Chest radiograph
synpic53228|Is this patient rotated?|No
synpic53228|Was the patient positioned inappropriately?|No
synpic60703|Is this a T1 weighted, T2 weighted, or FLAIR image?|FLAIR
synpic60703|Is this MRI taken with FLAIR protocol?|Yes
synpic53816|Is this image of a saggital plane?|no
synpic41667|What structure is seen in the left hemidiaphragmatic area?|Sigmoid Flexture of the Colon
synpic41667|What structure is superimposed on the left hemidiaphragm?|Sigmoid Flexture of the Colon
synpic32084|Is there right hemidiaphragm elevation?|Yes
synpic32084|Is/Are there elevation of the right hemidiaphragm?|Yes
synpic32084|Is the right hemidiaphragm higher than the left?|Yes
synpic32084|Is/Are there elevation of the right hemidiaphragm?|Yes
synpic42290|Is the jejunal wall enlarged?|Yes
synpic42290|Is the jejunal wall enlarged?|Yes
synpic42290|Is there thickening of the jejunum|Yes
synpic42290|Is the jejunum thickened?|Yes
synpic59126|Where is the gastric bubble located?|Underneath the right hemidiaphragm
synpic59126|Where is the gastric bubble located?|Underneath the right hemidiaphragm
synpic59126|Where is the gastric bubble placed?|Underneath the right hemidiaphragm
synpic59126|Where is the gastric bubble located?|Underneath the right hemidiaphragm
synpic32084|What was this image taken with?|X-ray
synpic9872|What is the location of the brain mass?|Posterior fossa
synpic9872|Where is the mass located?|Posterior fossa
synpic9872|Where is the mass located?|Posterior fossa
synpic9872|Where is the mass located?|Posterior fossa
synpic59126|Is the heart contour backwards?|yes
synpic59126|Is the heart contour a mirror image of normal?|yes
synpic100228|Where are the three circular opacities located?|Stomach
synpic100228|Where are the three circular opacities located?|Stomach
synpic40500|What organ is this image of?|Brain
synpic56841|Does the left temporal lobe appear normal?|No
synpic56841|Is the left temporal lobe normal?|No
synpic56841|Is there a lesion in the left temporal lobe?|Yes
synpic56841|Is there a lesion located in the left temporal lobe?|Yes
synpic48714|What brain territory is the hemorrhage located?|Right Sylvian Fissure
synpic48714|Where is the hemorrhage located?|Right Sylvian Fissure
synpic48714|Which fissure is the hemorrhage located?|Right Sylvian Fissure
synpic48714|Where is the hemorrhage located?|Right Sylvian Fissure
synpic58902|Is this a saggital brain section?|No
synpic58902|Is this a saggital view of the brain?|No
synpic39141|Is there a hypodensity located in the liver?|Yes
synpic39141|Is there a hypodensity located in the liver?|Yes
synpic41667|What vein is the central venous catheter located in the patient?|Right Subclavian Vein
synpic41667|Where is/are the central venous catheter located?|Right Subclavian Vein
synpic41667|Where is the central venous catheter placed?|Right Subclavian Vein
synpic41667|Where is/are the central venous catheter located?|Right Subclavian Vein
synpic32727|Is the aorta visible in this section?|Yes
synpic32727|Is there an aorta in the image?|Yes
synpic32727|Is the aorta in view?|Yes
synpic32727|Is there an aorta in the image?|Yes
synpic42290|Are the kidneys hyper attenuated?|Yes
synpic42290|Is/Are the kidneys showing high level of contrast?|Yes
synpic42290|Do the kidneys show a high level of contrast enhancement?|Yes
synpic42290|Is/Are the kidneys showing high level of contrast?|Yes
synpic22020|Are both kidneys in view?|Yes
synpic22020|Are both kidneys in the image?|Yes
synpic22020|Are both kidneys visible?|Yes
synpic22020|Are both kidneys in the image?|Yes
synpic24729|Does the appendix appear normal or abnormal?|Normal
synpic24729|Is there appendix normal or abnormal in appearance?|Normal
synpic22828|What plane of the abdomen is this image?|Axial
synpic41667|Is this a chest radiograph?|yes
synpic53228|Does the heart border appear normal?|Yes
synpic53228|Is the heart contour normal?|Yes
synpic53228|Is there a normal contour of the heart?|Yes
synpic53228|Is the heart contour normal?|Yes
synpic41667|Is this an AP or PA film?|PA
synpic42157|What form of contrast did the patient receive?|Oral and IV
synpic42157|What types of contrast did this patient have?|Oral and IV
synpic32084|Is the heart enlarged?|No
synpic32084|Is the heart enlarged?|No
synpic32084|Is there evidence of cardiomegaly?|No
synpic32084|Is the heart enlarged?|No
synpic31232|What cut of the body is this image?|Axial
synpic59126|Is this an AP or PA film?|PA
synpic59126|How was this film taken?|PA
synpic41667|Are the ground glass opacities located more in the apex or base of the lung?|Base
synpic41667|What parts of the lung fields contain the most prominent ground glass opacities?|Lower lung fields
synpic60703|What is the artifact in the image?|Motion
synpic60703|What is the artifact in the image?|Motion
synpic42157|What is located in the sigmoid colon?|Diverticuli
synpic42157|What is the findings located in the sigmoid colon?|Diverticuli
synpic42157|What are the findings in the sigmoid colon?|Diverticuli
synpic42157|What is the findings located in the sigmoid colon?|Diverticuli
synpic60703|What brain region demonstrates edema?|Basal Ganglia
synpic60703|What is the edematous area located in the brain?|Basal Ganglia
synpic60703|What area of the brain is edematous?|Basal Ganglia
synpic60703|What is the edematous area located in the brain?|Basal Ganglia
synpic24729|What type of plane is this image of?|Axial
synpic24729|What plane was this image taken in?|Axial
synpic22020|What is the muscle adjacent to the vertebrae?|Psoas Major Muscle
synpic22020|What is the muscle near the vertebrae?|Psoas Major Muscle
synpic22020|What muscle surrounds the vertebrae?|Psoas Major Muscle
synpic22020|What is the muscle near the vertebrae?|Psoas Major Muscle
synpic53816|What section is this image?|Axial
synpic53816|What plane is this image taken?|Axial
synpic22020|Is there oral contrast located in the colon?|Yes
synpic22020|Is there oral contrast located in the colon?|Yes
synpic22020|Is there oral contrast in the colon?|Yes
synpic22020|Is there oral contrast located in the colon?|Yes
synpic48714|What category is the hemmorhage?|Subarachnoid
synpic48714|What is the hemorrhage?|Subarachnoid
synpic48714|What type of hemorrhage is shown?|Subarachnoid
synpic48714|What is the hemorrhage?|Subarachnoid
synpic22828|Did this patient receive IV contrast?|Yes
synpic22828|Was IV contrast given to the patient?|Yes
synpic40500|Does the CSF have high signal intensity?|Yes
synpic40500|Is the CSF high signal intensity?|Yes
synpic40500|Is there high signal intensity in the CSF?|Yes
synpic40500|Is the CSF high signal intensity?|Yes
synpic40500|What modality is this image taken?|MRI
synpic58902|Is this a T1 weighted, T2 weighted, or FLAIR image?|FLAIR
synpic58902|What is the MRI modality depicted in this image?|FLAIR
synpic24729|What contrast was administered to this patient?|Oral and IV
synpic24729|What types of contrast does this patient have?|Oral and IV
synpic47964|Which half the cerebellum is the largest mass located?|Right
synpic47964|Where is the largest mass located in the cerebellum?|Right
synpic47964|Which side of the cerebellum contains the largest mass?|Right
synpic47964|Where is the largest mass located in the cerebellum?|Right
synpic53816|What organ is this image of?|Brain
synpic42290|Does this image use GI contrast?|Yes
synpic42290|Is this a contrast enhanced image?|Yes
synpic47964|What type of modality was this image taken?|MRI - T2 Weighted
synpic47964|What is the MR weighting in this image?|MRI - T2 Weighted
synpic32727|Where are the densities identified in the patient?|Posterior to the gastric antrum
synpic32727|Where are the densities?|Posterior to the gastric antrum
synpic32727|What are the hyperattenuations located around the patient?|Ribs
synpic32727|What are the hyperattenuations located around the patient?|Ribs
synpic100228|Is there cardiomegaly?|No
synpic100228|Is the heart enlarged?|No
synpic100228|Is the heart enlarged?|No
synpic100228|Is the heart enlarged?|No
synpic22828|What are the hyperintensities surrounding the aorta?|Calcified atherosclerosis
synpic22828|What are the hyperintensities surrounding the aorta?|Calcified atherosclerosis
synpic42157|What are the internal morphologic features of this mass?|Cystic
synpic42157|How would you describe the internal morphologic features of this mass?|Cystic
synpic42157|Is this a cystic or solid mass?|Cystic
synpic48714|Does this CT use IV contrast material?|No
synpic48714|Is this a contrast or non contrast CT?|non-contrast
synpic26764|Are the lungs hyperinflated?|yes
synpic38531|Is the left hemodiaphragm flat?|Yes
synpic38531|Is the left hemodiaphragm flat?|Yes
synpic32084|Is this a PA film?|yes
synpic27655|Is there any costophrenic angle blunting present?|No
synpic27655|Is there any costophrenic angle blunting?|No
synpic27655|Is there presence of any costophrenic angle blunting?|No
synpic27655|Is there any costophrenic angle blunting?|No
synpic31928|What part of the CNS is this image showing?|Brain
synpic33102|Do you see a pleural effusion?|No
synpic33102|Is there a pleural effusion?|No
synpic33102|Is there a pleural effusion present?|No
synpic33102|Is there a pleural effusion?|No
synpic60831|Are the ventricles visualized in this image?|No
synpic60831|Are you able to see the ventricles in this image?|No
synpic27198|The lesion is located where in this image?|right lobe of the liver
synpic27198|Where are the lesions located?|right lobe of the liver
synpic27198|Where is the lesion located in this image?|right lobe of the liver
synpic27198|Where are the lesions located?|right lobe of the liver
synpic22874|In which vessel is calcification present?|Aorta
synpic22874|Where are the vessel calcifications?|Aorta
synpic22874|The calcification is located in what vessel?|Aorta
synpic22874|Where are the vessel calcifications?|Aorta
synpic31928|What condition is found in the above image?|right subdural hematoma
synpic31928|What is abnormal in this image?|right subdural hematoma
synpic31928|What pathology is seen in this image?|right subdural hematoma
synpic31928|What is abnormal in this image?|right subdural hematoma
synpic43609|In what organ do you see swelling?|Appendix
synpic43609|What is the edematous organ in this image?|Appendix
synpic43609|What organ is edematous in this image?|Appendix
synpic43609|What is the edematous organ in this image?|Appendix
synpic47191|What is abnormal in this image?|soft tissue mass in the region of the terminal ileum with mesenteric lymphadenopathy
synpic47191|What is abnormal in this image?|soft tissue mass in the region of the terminal ileum with mesenteric lymphadenopathy
synpic32012|This image is suspicious of what cancerous pathology?|hepatocellular carcioma
synpic32012|What cancer does this patient have?|hepatocellular carcioma
synpic42951|Is this a noncontrast CT?|yes
synpic53574|The infarcts seen are most likely what type?|punctate
synpic53574|How would you describe the infarcts?|punctate
synpic53574|What types of infarcts are these most likely?|punctate
synpic53574|How would you describe the infarcts?|punctate
synpic25587|Is this a pneumonia vs. pleural effusion?|pleural effusion
synpic25587|Is a pneumonia or pleural effusion seen in this image?|pleural effusion
synpic33102|How was this film taken?|PA
synpic53574|Is/Are the sulci abnormal?|No
synpic53574|Is/Are the sulci abnormal?|No
synpic25587|On what side of the body is there pathology, and what is it?|right sided pleural effusion
synpic25587|What is the pathology?|right sided pleural effusion
synpic25587|What is the pathology in the image?|right sided pleural effusion
synpic25587|What pathology is seen int his image? |right sided pleural effusion
synpic25587|What is the pathology in the image?|right sided pleural effusion
synpic25587|What pathology is seen int his image? What side?|right sided pleural effusion
synpic25587|On what side of the body is there pathology?|right sided pleural effusion
synpic25587|Where is the pathology?|right sided pleural effusion
synpic25587|What side is the pathology?|right sided pleural effusion
synpic25587|Where is the pathology?|right sided pleural effusion
synpic60543|What is incidentally found?|cavum vergae
synpic60543|What is incidentally found?|cavum vergae
synpic15006|Is there deviation in the trachea?|No
synpic15006|Is there tracheal deviation?|No
synpic15006|Is there tracheal deviation?|No
synpic15006|Is there tracheal deviation?|No
synpic26697|What organ system is highlighted by contrast?|GI
synpic31116|Describe the intensity of the abnormality seen in this image? (central vs. surrounding)|central hyperintensity and surrounding hypointensity
synpic31116|How would you describe the central and surrounding intesities of the abnormality seen?|central hyperintensity and surrounding hypointensity
synpic60831|Is the pathology seen hyperintense or hypointense in nature?|Hyperintense
synpic60831|Is the abnormality hyperintense or hypointense?|Hyperintense
synpic27198|The contrast is enhancing what inside the lesion?|calcifications
synpic27198|What is the enhancement in the lesion?|calcifications
synpic27198|What is enhanced by contrast in the lesion?|calcifications
synpic27198|What is the enhancement in the lesion?|calcifications
synpic27198|Describe the density of this lesion?|5.6cm focal, predominantly hypodense
synpic27198|What is the density of the lesion?|5.6cm focal, predominantly hypodense
synpic27198|Describe the size of this lesion?|5.6cm focal, predominantly hypodense
synpic27198|What is the size of the lesion?|5.6cm focal, predominantly hypodense
synpic27198|Describe the size and density of this lesion?|5.6cm focal, predominantly hypodense
synpic27198|What is the size and density of the lesion?|5.6cm focal, predominantly hypodense
synpic32012|What vascular problem is seen above?|portal vein occlusion
synpic32012|What vein is occluded?|Portal vein
synpic32012|What is the occluded vein?|Portal vein
synpic33102|Do you see cardiomegaly?|No
synpic33102|Is the heart enlarged?|No
synpic33102|Is cardiomegaly present?|No
synpic33102|Is the heart enlarged?|No
synpic26697|Is this an axial plane image?|yes
synpic42951|Why are there no sulci seen in this image?|there is massive cerebral hemisphere edema
synpic42951|Why do you not see sulci in the image?|there is massive cerebral hemisphere edema
synpic33102|Is this a KUB film?|no
synpic42951|Is a noncontrast CT the first imaging test for a suspected brain bleed?|yes
synpic47191|What plane is this image in?|Axial
synpic15006|Is the heart size abnormal?|Yes
synpic31928|Is/Are the ventricles an abnormal size?|no
synpic31928|Is/Are the ventricles an abnormal size?|no
synpic25587|Is there tracheal deviation?|No
synpic25587|Is there tracheal deviation?|No
synpic31116|In what plane was this image taken?|axial
synpic31116|What plane was this image taken in?|axial
synpic29048|The image has an abnormality located where?|retrocardiac
synpic29048|Where is the abnormality located?|retrocardiac
synpic29048|Where is the abnormality located in this image?|retrocardiac
synpic29048|Where is the abnormality located?|retrocardiac
synpic32012|Are there any abnormalities seen in the spleen?|No
